{
 "$schema": "./stations.schema.json",
 "dataset": "RailwayOne Pro sample stations",
 "version": "2026.10-sample",
 "license": "Sample data compiled for demonstration only. Coordinates are approximate. Replace with a properly licensed/authorised source before any real use.",
 "stations": [
  {
   "code": "NDLS",
   "name": "New Delhi",
   "city": "New Delhi",
   "state": "Delhi",
   "zone": "NR",
   "lat": 28.643,
   "lng": 77.2194,
   "isPopular": true
  },
  {
   "code": "DLI",
   "name": "Delhi Junction",
   "city": "Delhi",
   "state": "Delhi",
   "zone": "NR",
   "lat": 28.661,
   "lng": 77.228,
   "isPopular": false
  },
  {
   "code": "NZM",
   "name": "Hazrat Nizamuddin",
   "city": "New Delhi",
   "state": "Delhi",
   "zone": "NR",
   "lat": 28.588,
   "lng": 77.253,
   "isPopular": true
  },
  {
   "code": "ANVT",
   "name": "Anand Vihar Terminal",
   "city": "Delhi",
   "state": "Delhi",
   "zone": "NR",
   "lat": 28.6505,
   "lng": 77.3155,
   "isPopular": false
  },
  {
   "code": "DEE",
   "name": "Delhi Sarai Rohilla",
   "city": "Delhi",
   "state": "Delhi",
   "zone": "NR",
   "lat": 28.665,
   "lng": 77.186,
   "isPopular": false
  },
  {
   "code": "GZB",
   "name": "Ghaziabad",
   "city": "Ghaziabad",
   "state": "Uttar Pradesh",
   "zone": "NR",
   "lat": 28.65,
   "lng": 77.432,
   "isPopular": false
  },
  {
   "code": "CSMT",
   "name": "Chhatrapati Shivaji Maharaj Terminus",
   "city": "Mumbai",
   "state": "Maharashtra",
   "zone": "CR",
   "lat": 18.94,
   "lng": 72.8355,
   "isPopular": true
  },
  {
   "code": "MMCT",
   "name": "Mumbai Central",
   "city": "Mumbai",
   "state": "Maharashtra",
   "zone": "WR",
   "lat": 18.969,
   "lng": 72.8195,
   "isPopular": true
  },
  {
   "code": "LTT",
   "name": "Lokmanya Tilak Terminus",
   "city": "Mumbai",
   "state": "Maharashtra",
   "zone": "CR",
   "lat": 19.069,
   "lng": 72.89,
   "isPopular": false
  },
  {
   "code": "BDTS",
   "name": "Bandra Terminus",
   "city": "Mumbai",
   "state": "Maharashtra",
   "zone": "WR",
   "lat": 19.0625,
   "lng": 72.841,
   "isPopular": false
  },
  {
   "code": "DR",
   "name": "Dadar",
   "city": "Mumbai",
   "state": "Maharashtra",
   "zone": "CR",
   "lat": 19.0186,
   "lng": 72.843,
   "isPopular": false
  },
  {
   "code": "TNA",
   "name": "Thane",
   "city": "Thane",
   "state": "Maharashtra",
   "zone": "CR",
   "lat": 19.186,
   "lng": 72.975,
   "isPopular": false
  },
  {
   "code": "KYN",
   "name": "Kalyan Junction",
   "city": "Kalyan",
   "state": "Maharashtra",
   "zone": "CR",
   "lat": 19.2355,
   "lng": 73.1305,
   "isPopular": false
  },
  {
   "code": "PUNE",
   "name": "Pune Junction",
   "city": "Pune",
   "state": "Maharashtra",
   "zone": "CR",
   "lat": 18.5285,
   "lng": 73.874,
   "isPopular": true
  },
  {
   "code": "NK",
   "name": "Nashik Road",
   "city": "Nashik",
   "state": "Maharashtra",
   "zone": "CR",
   "lat": 19.948,
   "lng": 73.842,
   "isPopular": false
  },
  {
   "code": "MMR",
   "name": "Manmad Junction",
   "city": "Manmad",
   "state": "Maharashtra",
   "zone": "CR",
   "lat": 20.251,
   "lng": 74.437,
   "isPopular": false
  },
  {
   "code": "BSL",
   "name": "Bhusaval Junction",
   "city": "Bhusaval",
   "state": "Maharashtra",
   "zone": "CR",
   "lat": 21.048,
   "lng": 75.788,
   "isPopular": false
  },
  {
   "code": "NGP",
   "name": "Nagpur Junction",
   "city": "Nagpur",
   "state": "Maharashtra",
   "zone": "CR",
   "lat": 21.152,
   "lng": 79.088,
   "isPopular": true
  },
  {
   "code": "SUR",
   "name": "Solapur",
   "city": "Solapur",
   "state": "Maharashtra",
   "zone": "CR",
   "lat": 17.664,
   "lng": 75.893,
   "isPopular": false
  },
  {
   "code": "KOP",
   "name": "Kolhapur SCSMT",
   "city": "Kolhapur",
   "state": "Maharashtra",
   "zone": "CR",
   "lat": 16.703,
   "lng": 74.24,
   "isPopular": false
  },
  {
   "code": "AWB",
   "name": "Chhatrapati Sambhajinagar",
   "city": "Chhatrapati Sambhajinagar",
   "state": "Maharashtra",
   "zone": "SCR",
   "lat": 19.863,
   "lng": 75.315,
   "isPopular": false
  },
  {
   "code": "HWH",
   "name": "Howrah Junction",
   "city": "Kolkata",
   "state": "West Bengal",
   "zone": "ER",
   "lat": 22.5835,
   "lng": 88.3425,
   "isPopular": true
  },
  {
   "code": "SDAH",
   "name": "Sealdah",
   "city": "Kolkata",
   "state": "West Bengal",
   "zone": "ER",
   "lat": 22.5675,
   "lng": 88.37,
   "isPopular": true
  },
  {
   "code": "KOAA",
   "name": "Kolkata",
   "city": "Kolkata",
   "state": "West Bengal",
   "zone": "ER",
   "lat": 22.604,
   "lng": 88.38,
   "isPopular": false
  },
  {
   "code": "ASN",
   "name": "Asansol Junction",
   "city": "Asansol",
   "state": "West Bengal",
   "zone": "ER",
   "lat": 23.691,
   "lng": 86.975,
   "isPopular": false
  },
  {
   "code": "KGP",
   "name": "Kharagpur Junction",
   "city": "Kharagpur",
   "state": "West Bengal",
   "zone": "SER",
   "lat": 22.339,
   "lng": 87.325,
   "isPopular": false
  },
  {
   "code": "NJP",
   "name": "New Jalpaiguri",
   "city": "Siliguri",
   "state": "West Bengal",
   "zone": "NFR",
   "lat": 26.684,
   "lng": 88.443,
   "isPopular": false
  },
  {
   "code": "BWN",
   "name": "Barddhaman Junction",
   "city": "Barddhaman",
   "state": "West Bengal",
   "zone": "ER",
   "lat": 23.249,
   "lng": 87.869,
   "isPopular": false
  },
  {
   "code": "MAS",
   "name": "Chennai Central",
   "city": "Chennai",
   "state": "Tamil Nadu",
   "zone": "SR",
   "lat": 13.0825,
   "lng": 80.275,
   "isPopular": true
  },
  {
   "code": "MS",
   "name": "Chennai Egmore",
   "city": "Chennai",
   "state": "Tamil Nadu",
   "zone": "SR",
   "lat": 13.078,
   "lng": 80.261,
   "isPopular": false
  },
  {
   "code": "TBM",
   "name": "Tambaram",
   "city": "Chennai",
   "state": "Tamil Nadu",
   "zone": "SR",
   "lat": 12.9245,
   "lng": 80.1275,
   "isPopular": false
  },
  {
   "code": "KPD",
   "name": "Katpadi Junction",
   "city": "Vellore",
   "state": "Tamil Nadu",
   "zone": "SR",
   "lat": 12.971,
   "lng": 79.138,
   "isPopular": false
  },
  {
   "code": "SA",
   "name": "Salem Junction",
   "city": "Salem",
   "state": "Tamil Nadu",
   "zone": "SR",
   "lat": 11.672,
   "lng": 78.117,
   "isPopular": false
  },
  {
   "code": "CBE",
   "name": "Coimbatore Junction",
   "city": "Coimbatore",
   "state": "Tamil Nadu",
   "zone": "SR",
   "lat": 10.997,
   "lng": 76.967,
   "isPopular": false
  },
  {
   "code": "TPJ",
   "name": "Tiruchchirappalli Junction",
   "city": "Tiruchchirappalli",
   "state": "Tamil Nadu",
   "zone": "SR",
   "lat": 10.796,
   "lng": 78.687,
   "isPopular": false
  },
  {
   "code": "MDU",
   "name": "Madurai Junction",
   "city": "Madurai",
   "state": "Tamil Nadu",
   "zone": "SR",
   "lat": 9.919,
   "lng": 78.111,
   "isPopular": false
  },
  {
   "code": "SBC",
   "name": "KSR Bengaluru City",
   "city": "Bengaluru",
   "state": "Karnataka",
   "zone": "SWR",
   "lat": 12.978,
   "lng": 77.5695,
   "isPopular": true
  },
  {
   "code": "YPR",
   "name": "Yesvantpur Junction",
   "city": "Bengaluru",
   "state": "Karnataka",
   "zone": "SWR",
   "lat": 13.023,
   "lng": 77.55,
   "isPopular": false
  },
  {
   "code": "SMVB",
   "name": "SMVT Bengaluru",
   "city": "Bengaluru",
   "state": "Karnataka",
   "zone": "SWR",
   "lat": 12.993,
   "lng": 77.661,
   "isPopular": false
  },
  {
   "code": "MYS",
   "name": "Mysuru Junction",
   "city": "Mysuru",
   "state": "Karnataka",
   "zone": "SWR",
   "lat": 12.316,
   "lng": 76.645,
   "isPopular": false
  },
  {
   "code": "UBL",
   "name": "Hubballi Junction",
   "city": "Hubballi",
   "state": "Karnataka",
   "zone": "SWR",
   "lat": 15.35,
   "lng": 75.149,
   "isPopular": false
  },
  {
   "code": "MAQ",
   "name": "Mangaluru Central",
   "city": "Mangaluru",
   "state": "Karnataka",
   "zone": "SR",
   "lat": 12.864,
   "lng": 74.842,
   "isPopular": false
  },
  {
   "code": "SC",
   "name": "Secunderabad Junction",
   "city": "Hyderabad",
   "state": "Telangana",
   "zone": "SCR",
   "lat": 17.4335,
   "lng": 78.5015,
   "isPopular": true
  },
  {
   "code": "HYB",
   "name": "Hyderabad Deccan",
   "city": "Hyderabad",
   "state": "Telangana",
   "zone": "SCR",
   "lat": 17.392,
   "lng": 78.4675,
   "isPopular": false
  },
  {
   "code": "KCG",
   "name": "Kacheguda",
   "city": "Hyderabad",
   "state": "Telangana",
   "zone": "SCR",
   "lat": 17.3895,
   "lng": 78.5,
   "isPopular": false
  },
  {
   "code": "BZA",
   "name": "Vijayawada Junction",
   "city": "Vijayawada",
   "state": "Andhra Pradesh",
   "zone": "SCR",
   "lat": 16.518,
   "lng": 80.62,
   "isPopular": false
  },
  {
   "code": "GNT",
   "name": "Guntur Junction",
   "city": "Guntur",
   "state": "Andhra Pradesh",
   "zone": "SCR",
   "lat": 16.299,
   "lng": 80.443,
   "isPopular": false
  },
  {
   "code": "TPTY",
   "name": "Tirupati",
   "city": "Tirupati",
   "state": "Andhra Pradesh",
   "zone": "SCR",
   "lat": 13.629,
   "lng": 79.419,
   "isPopular": false
  },
  {
   "code": "VSKP",
   "name": "Visakhapatnam",
   "city": "Visakhapatnam",
   "state": "Andhra Pradesh",
   "zone": "ECoR",
   "lat": 17.722,
   "lng": 83.29,
   "isPopular": false
  },
  {
   "code": "PNBE",
   "name": "Patna Junction",
   "city": "Patna",
   "state": "Bihar",
   "zone": "ECR",
   "lat": 25.603,
   "lng": 85.137,
   "isPopular": true
  },
  {
   "code": "RJPB",
   "name": "Rajendra Nagar Terminal",
   "city": "Patna",
   "state": "Bihar",
   "zone": "ECR",
   "lat": 25.6005,
   "lng": 85.165,
   "isPopular": false
  },
  {
   "code": "PPTA",
   "name": "Patliputra Junction",
   "city": "Patna",
   "state": "Bihar",
   "zone": "ECR",
   "lat": 25.6205,
   "lng": 85.0915,
   "isPopular": false
  },
  {
   "code": "DNR",
   "name": "Danapur",
   "city": "Patna",
   "state": "Bihar",
   "zone": "ECR",
   "lat": 25.585,
   "lng": 85.045,
   "isPopular": false
  },
  {
   "code": "GAYA",
   "name": "Gaya Junction",
   "city": "Gaya",
   "state": "Bihar",